{
  "projectName": "Vendor Access Hub",
  "summary": "A web application for managing third-party vendor onboarding, access requests, and approval workflows for internal teams.",
  "targetUsers": [
    "internal IT admins",
    "security reviewers",
    "external vendors"
  ],
  "coreFeatures": [
    "vendor onboarding form",
    "approval workflow for access requests",
    "audit trail for approvals",
    "admin dashboard"
  ],
  "constraints": [
    "must be reviewable by security stakeholders",
    "small team shipping first version in 8 weeks",
    "prefer TypeScript and a single deployable unit initially"
  ],
  "nonFunctionalRequirements": [
    "role-based access control",
    "auditability",
    "basic uptime monitoring"
  ],
  "integrations": [
    "email delivery",
    "SSO provider"
  ],
  "dataSensitivity": "high",
  "teamSize": 4,
  "productionExpectedSoon": true,
  "liveUsers": false,
  "enterpriseRequirements": [
    "customer security review expected",
    "sensitive internal business data"
  ],
  "openQuestions": [
    "Should vendors authenticate directly or through invitation links?",
    "Is a separate document store required for compliance attachments?"
  ]
}
